{
  "decision": "arm",
  "strategy_contract_id": "SQ02_DOWNSIDE_CONT_V0",
  "campaign_id": "campaign-local-001",
  "session_id": "session-sq02-local-001",
  "allowed_from_ms": 1000,
  "allowed_until_ms": 2000,
  "decided_by": "owner",
  "audit_provenance": "docs_schema_example",
  "reason": "local sandbox example only"
}
